{
  "$schema": "http://json-schema.org/draft-07/schema#",
  "type": "object",
  "required": [
    "user_id",
    "product_id",
    "product_name",
    "product_amount",
    "qty",
    "tax_amt",
    "total_amt"
  ],
  "properties": {
    "id": { "type": "integer" },
    "user_id": { "type": "string" },
    "product_id": { "type": "string" },
    "product_name": { "type": "string" },
    "product_amount": { "type": "number" },
    "qty": { "type": "integer" },
    "tax_amt": { "type": "number" },
    "total_amt": { "type": "number" }
  }
}
